{
  "schema_version": "0.1",
  "runner_id": "6e5a3f57-9128-42a6-8345-7a1b3c6f9ec5",
  "runner_version": "0.1.0",
  "contract_version": "0.1",
  "adapter_version": "golden-1.0.0",
  "capabilities": {
    "max_concurrent_cases": 1,
    "supports_observations": true,
    "supports_artifacts": false
  }
}
